{
  "schema_version": "1.0",
  "category": "03_numbers",
  "topic": "integer",
  "title": "정수",
  "description": "정수 값을 만들고 기본 계산을 하는 예제입니다.",
  "level": "beginner",
  "prerequisites": [
    "variables",
    "operators"
  ],
  "learning_objectives": [
    "정수 값을 변수에 저장할 수 있다.",
    "정수로 기본 계산을 할 수 있다."
  ],
  "examples": [
    {
      "order": 1,
      "id": "create_integer",
      "file": "001_create_integer.py",
      "title": "정수 만들기",
      "goal": "정수 값을 변수에 저장하고 출력한다.",
      "interactive": false
    },
    {
      "order": 2,
      "id": "integer_calculation",
      "file": "002_integer_calculation.py",
      "title": "정수 계산하기",
      "goal": "정수로 더하기와 곱하기를 할 수 있다.",
      "interactive": false
    }
  ]
}
